{
  "schemaVersion": 2,
  "rendererVersion": "2.0.0",
  "shape": "circle",
  "canvas": { "logicalWidth": 1000, "logicalHeight": 1000, "exportWidth": 1200, "transparent": true },
  "color": "#d92626",
  "border": { "width": 6, "doubleLine": false, "innerRing": false, "innerAdjust": 0 },
  "layers": [
    { "id": "border", "kind": "border", "visible": true, "locked": true, "zIndex": 0 },
    { "id": "main-text", "kind": "arcText", "visible": true, "locked": false, "zIndex": 10, "content": "示例科技有限公司", "fontId": "system-serif", "fontSize": 72, "letterSpacing": 6, "scaleX": 1, "scaleY": 1, "rotation": 0, "offsetX": 0, "offsetY": 20, "radiusX": 335, "radiusY": 335, "startAngle": 180, "sweepAngle": 180 },
    { "id": "inner-text", "kind": "arcText", "visible": false, "locked": false, "zIndex": 11, "content": "", "fontId": "system-sans", "fontSize": 34, "letterSpacing": 4, "scaleX": 1, "scaleY": 1, "rotation": 0, "offsetX": 0, "offsetY": 35, "radiusX": 270, "radiusY": 270, "startAngle": 180, "sweepAngle": 180 },
    { "id": "bottom-text", "kind": "arcText", "visible": true, "locked": false, "zIndex": 12, "content": "合同专用章", "fontId": "system-sans", "fontSize": 38, "letterSpacing": 4, "scaleX": 1, "scaleY": 1, "rotation": 0, "offsetX": 0, "offsetY": 0, "radiusX": 260, "radiusY": 260, "startAngle": 0, "sweepAngle": -180 },
    { "id": "center", "kind": "centerText", "visible": true, "locked": false, "zIndex": 20, "content": "★", "fontId": "system-serif", "fontSize": 220, "letterSpacing": 0, "scaleX": 1, "scaleY": 1, "rotation": 0, "offsetX": 0, "offsetY": 0 }
  ],
  "texture": { "enabled": true, "type": "ink", "intensity": 34, "density": 42, "grainSize": 6, "edgeWear": 25, "scratchCount": 8, "fade": 22, "seed": 928341, "applyTo": ["border", "text", "center"] }
}
